{
  "schemaFormat": "yamamuki-point-supplements",
  "schemaVersion": 2,
  "metadata": {
    "sources": [
      {
        "name": "日本百名山",
        "source": "Wikipedia「日本百名山」の「著書順の山の一覧」 https://ja.wikipedia.org/w/index.php?title=日本百名山#著書順の山の一覧",
        "license": "CC BY-SA 4.0 https://creativecommons.org/licenses/by-sa/4.0/",
        "attribution": "Wikipedia「日本百名山」の投稿者 https://ja.wikipedia.org/w/index.php?title=日本百名山&action=history",
        "changes": "山名一覧を国土地理院の地点 ID に対応付けた採用地点を、OSM の名前・別名・位置と照合して OSM の地点 ID に対応付け、ユーザーがビューアーで採用地点・名称・読み・別名・タグ・配布除外を手動調整した。"
      }
    ],
    "tags": [
      {
        "name": "日本百名山",
        "nameReading": "にほんひゃくめいざん"
      }
    ]
  },
  "points": [
    {
      "id": "osm:1366603243",
      "note": "羅臼岳",
      "tags": [
        "日本百名山"
      ]
    },
    {
      "id": "osm:1366603214",
      "note": "斜里岳",
      "tags": [
        "日本百名山"
      ]
    },
    {
      "id": "osm:1366603211",
      "note": "雌阿寒岳",
      "tags": [
        "日本百名山"
      ]
    },
    {
      "id": "osm:811793558",
      "note": "旭岳",
      "tags": [
        "日本百名山"
      ]
    },
    {
      "id": "osm:1366603238",
      "note": "トムラウシ山",
      "tags": [
        "日本百名山"
      ]
    },
    {
      "id": "osm:1366603231",
      "note": "十勝岳",
      "tags": [
        "日本百名山"
      ]
    },
    {
      "id": "osm:1366603199",
      "note": "幌尻岳",
      "tags": [
        "日本百名山"
      ]
    },
    {
      "id": "osm:4382929357",
      "note": "岩木山",
      "tags": [
        "日本百名山"
      ]
    },
    {
      "id": "osm:3258247280",
      "note": "大岳",
      "name": "八甲田山",
      "nameReading": "はっこうださん",
      "aliases": [
        {
          "name": "大岳",
          "nameReading": "おおだけ"
        }
      ],
      "aliasesRemove": [
        "八甲田山"
      ],
      "tags": [
        "日本百名山"
      ]
    },
    {
      "id": "osm:3259131479",
      "note": "八幡平",
      "tags": [
        "日本百名山"
      ]
    },
    {
      "id": "osm:3259271871",
      "note": "薬師岳",
      "name": "岩手山",
      "nameReading": "いわてさん",
      "tags": [
        "日本百名山"
      ]
    },
    {
      "id": "osm:3259271873",
      "note": "早池峰山",
      "tags": [
        "日本百名山"
      ]
    },
    {
      "id": "osm:3740788022",
      "note": "鳥海山山頂(新山)",
      "name": "鳥海山",
      "nameReading": "ちょうかいさん",
      "aliases": [
        {
          "name": "新山",
          "nameReading": "しんざん"
        }
      ],
      "tags": [
        "日本百名山"
      ]
    },
    {
      "id": "osm:3259293973",
      "note": "月山",
      "tags": [
        "日本百名山"
      ]
    },
    {
      "id": "osm:3259293971",
      "note": "大朝日岳",
      "tags": [
        "日本百名山"
      ]
    },
    {
      "id": "osm:3259286462",
      "note": "熊野岳",
      "name": "蔵王山",
      "nameReading": "ざおうざん",
      "aliases": [
        {
          "name": "熊野岳",
          "nameReading": "くまのだけ"
        }
      ],
      "tags": [
        "日本百名山"
      ]
    },
    {
      "id": "osm:3259600542",
      "note": "西吾妻山",
      "tags": [
        "日本百名山"
      ]
    },
    {
      "id": "osm:314604464",
      "note": "安達太良山",
      "tags": [
        "日本百名山"
      ]
    },
    {
      "id": "osm:314604715",
      "note": "磐梯山",
      "tags": [
        "日本百名山"
      ]
    },
    {
      "id": "osm:3259600548",
      "note": "会津駒ヶ岳",
      "nameReading": "あいづこまがたけ",
      "aliases": [
        {
          "name": "駒ヶ岳",
          "nameReading": "こまがたけ"
        }
      ],
      "tags": [
        "日本百名山"
      ]
    },
    {
      "id": "osm:3261275254",
      "note": "駒ヶ岳",
      "name": "越後駒ヶ岳",
      "nameReading": "えちごこまがたけ",
      "aliases": [
        {
          "name": "駒ヶ岳",
          "nameReading": "こまがたけ"
        },
        {
          "name": "魚沼駒ヶ岳",
          "nameReading": "うおぬまこまがたけ"
        }
      ],
      "aliasesRemove": [
        "越後駒ヶ岳"
      ],
      "tags": [
        "日本百名山"
      ]
    },
    {
      "id": "osm:3261275223",
      "note": "平ヶ岳",
      "nameReading": "ひらがたけ",
      "tags": [
        "日本百名山"
      ]
    },
    {
      "id": "osm:1275890209",
      "note": "巻機山",
      "nameReading": "まきはたやま",
      "tags": [
        "日本百名山"
      ]
    },
    {
      "id": "osm:3259600536",
      "note": "柴安嵓",
      "name": "燧ヶ岳",
      "nameReading": "ひうちがたけ",
      "aliases": [
        {
          "name": "柴安嵓",
          "nameReading": "しばやすぐら"
        }
      ],
      "tags": [
        "日本百名山"
      ]
    },
    {
      "id": "osm:1362332367",
      "note": "至仏山",
      "tags": [
        "日本百名山"
      ]
    },
    {
      "id": "osm:3261275245",
      "note": "谷川岳 オキノ耳",
      "name": "谷川岳",
      "nameReading": "たにがわだけ",
      "aliases": [
        {
          "name": "オキノ耳",
          "nameReading": "おきのみみ"
        }
      ],
      "aliasesRemove": [
        "谷川岳"
      ],
      "tags": [
        "日本百名山"
      ]
    },
    {
      "id": "osm:3261275250",
      "note": "雨飾山",
      "nameReading": "あまかざりやま",
      "tags": [
        "日本百名山"
      ]
    },
    {
      "id": "osm:3261275240",
      "note": "苗場山",
      "tags": [
        "日本百名山"
      ]
    },
    {
      "id": "osm:3156235450",
      "note": "妙高山",
      "tags": [
        "日本百名山"
      ]
    },
    {
      "id": "osm:3156235451",
      "note": "火打山",
      "tags": [
        "日本百名山"
      ]
    },
    {
      "id": "osm:3261275255",
      "note": "高妻山",
      "tags": [
        "日本百名山"
      ]
    },
    {
      "id": "osm:3684227754",
      "note": "男体山",
      "tags": [
        "日本百名山"
      ]
    },
    {
      "id": "osm:3260851383",
      "note": "日光白根山",
      "nameReading": "にっこうしらねさん",
      "aliases": [
        {
          "name": "白根山",
          "nameReading": "しらねさん"
        }
      ],
      "tags": [
        "日本百名山"
      ]
    },
    {
      "id": "osm:3260851390",
      "note": "皇海山",
      "tags": [
        "日本百名山"
      ]
    },
    {
      "id": "osm:3261275233",
      "note": "武尊山",
      "tags": [
        "日本百名山"
      ]
    },
    {
      "id": "osm:1817309009",
      "note": "黒檜山",
      "name": "赤城山",
      "nameReading": "あかぎさん",
      "aliases": [
        {
          "name": "黒檜山",
          "nameReading": "くろびさん"
        }
      ],
      "tags": [
        "日本百名山"
      ]
    },
    {
      "id": "osm:1116288159",
      "note": "本白根山",
      "name": "草津白根山",
      "nameReading": "くさつしらねさん",
      "aliases": [
        {
          "name": "本白根山",
          "nameReading": "もとしらねさん"
        }
      ],
      "tags": [
        "日本百名山"
      ]
    },
    {
      "id": "osm:3757330948",
      "note": "四阿山",
      "tags": [
        "日本百名山"
      ]
    },
    {
      "id": "osm:510162677",
      "note": "浅間山",
      "tags": [
        "日本百名山"
      ]
    },
    {
      "id": "osm:3259610769",
      "note": "筑波山",
      "tags": [
        "日本百名山"
      ]
    },
    {
      "id": "osm:3268400982",
      "note": "白馬岳",
      "nameReading": [
        "しろうまだけ",
        "はくばだけ"
      ],
      "tags": [
        "日本百名山"
      ]
    },
    {
      "id": "osm:3268398655",
      "note": "五竜岳",
      "name": "五龍岳",
      "aliases": [
        {
          "name": "五竜岳",
          "nameReading": "ごりゅうだけ"
        }
      ],
      "tags": [
        "日本百名山"
      ]
    },
    {
      "id": "osm:3268401000",
      "note": "鹿島槍ヶ岳",
      "tags": [
        "日本百名山"
      ]
    },
    {
      "id": "osm:3268398660",
      "note": "剱岳",
      "tags": [
        "日本百名山"
      ]
    },
    {
      "id": "osm:1851379301",
      "note": "立山",
      "aliases": [
        {
          "name": "大汝山",
          "nameReading": "おおなんじやま"
        }
      ],
      "tags": [
        "日本百名山"
      ]
    },
    {
      "id": "osm:3268400986",
      "note": "薬師岳",
      "tags": [
        "日本百名山"
      ]
    },
    {
      "id": "osm:3268401001",
      "note": "黒部五郎岳",
      "aliases": [
        {
          "name": "中ノ俣岳",
          "nameReading": "なかのまただけ"
        }
      ],
      "tags": [
        "日本百名山"
      ]
    },
    {
      "id": "osm:3268400973",
      "note": "水晶岳",
      "aliases": [
        {
          "name": "黒岳",
          "nameReading": "くろだけ"
        }
      ],
      "tags": [
        "日本百名山"
      ]
    },
    {
      "id": "osm:3268400999",
      "note": "鷲羽岳",
      "tags": [
        "日本百名山"
      ]
    },
    {
      "id": "osm:582994395",
      "note": "槍ヶ岳",
      "tags": [
        "日本百名山"
      ]
    },
    {
      "id": "osm:165028676",
      "note": "奥穂高岳",
      "tags": [
        "日本百名山"
      ]
    },
    {
      "id": "osm:1954353628",
      "note": "常念岳",
      "nameReading": "じょうねんだけ",
      "tags": [
        "日本百名山"
      ]
    },
    {
      "id": "osm:3786299727",
      "note": "笠ヶ岳",
      "tags": [
        "日本百名山"
      ]
    },
    {
      "id": "osm:4318282024",
      "note": "焼岳",
      "tags": [
        "日本百名山"
      ]
    },
    {
      "id": "osm:1851367347",
      "note": "剣ヶ峰",
      "name": "乗鞍岳",
      "nameReading": "のりくらだけ",
      "aliases": [
        {
          "name": "剣ヶ峰",
          "nameReading": "けんがみね"
        }
      ],
      "tags": [
        "日本百名山"
      ]
    },
    {
      "id": "osm:1851342877",
      "note": "御嶽山",
      "aliases": [
        {
          "name": "剣ヶ峰",
          "nameReading": "けんがみね"
        }
      ],
      "tags": [
        "日本百名山"
      ]
    },
    {
      "id": "osm:1150839523",
      "note": "王ヶ頭",
      "name": "美ヶ原",
      "nameReading": "うつくしがはら",
      "aliases": [
        {
          "name": "王ヶ頭",
          "nameReading": "おうがとう"
        }
      ],
      "tags": [
        "日本百名山"
      ]
    },
    {
      "id": "osm:1140877707",
      "note": "車山",
      "name": "霧ヶ峰",
      "nameReading": "きりがみね",
      "aliases": [
        {
          "name": "車山",
          "nameReading": "くるまやま"
        }
      ],
      "tags": [
        "日本百名山"
      ]
    },
    {
      "id": "osm:2933768500",
      "note": "蓼科山",
      "tags": [
        "日本百名山"
      ]
    },
    {
      "id": "osm:1827243160",
      "note": "赤岳",
      "aliases": [
        {